{
  "$schema": "https://json-schema.org/draft/2020-12/schema",
  "$id": "backup-manifest.schema.json",
  "title": "The manifest of one database snapshot (form 2)",
  "description": "Every snapshot the portal takes is a folder, web/_backups/upgrade-YYYYMMDD-HHMMSS/, holding one file per table and this manifest, _manifest.json. The manifest is written LAST, under another name, and then renamed: so a folder that has a readable manifest is a finished snapshot, and a folder without one is a snapshot that failed, was cut off, or is still being taken, and must never be counted as a backup. Written and read by Portal\\Core\\DbBackup (web/_core/DbBackup.php). Checked, against a real sample, by tools/audit-checks/check_backup_column_types.py.",
  "$comment": "FOR MAINTAINERS. JSON has no comments, so every explanation lives here. This describes FORM 2, written since October 2026 (#577, #579). A manifest with no 'format' property at all is FORM 1, the older shape: one pretty-printed tblName.json per table, and only created_at, reason, php_version, mysql_server and, per table, columns, rows and sha256. Form 1 is still read and restored, but never written, and is not described by this schema. If the shape written ever changes, raise DbBackup::FORMAT, keep the old reader, run tools/backup-restore-selftest.php --write-samples to refresh the sample, and bring this file into line: the self-test compares the sample's property names with what the class writes today, and the check compares the sample with this schema, so the three cannot drift apart unnoticed. An older release refuses a snapshot whose format is higher than it knows. ADDED 27 OCTOBER 2026, still form 2: 'whole_database' and 'table_count'. They are NOT in 'required', on purpose — a form-2 manifest written before that date does not carry them and must still validate and still restore. The format number was deliberately NOT raised: the addition is backward compatible in both directions (an older release ignores two unknown properties; this release treats their absence as 'does not say'), and raising it would make older releases refuse snapshots they can read perfectly well. The schema change itself was NOT optional, because this object sets additionalProperties to false.",
  "type": "object",
  "additionalProperties": false,
  "required": ["format", "created_at", "reason", "php_version", "mysql_server", "portal_version", "time_zone", "tables", "unlisted_values"],
  "properties": {
    "format": {
      "description": "Which form the snapshot's files are in. 2 today. A release that meets a higher number refuses the snapshot and changes nothing, because it cannot know what the newer form means.",
      "type": "integer",
      "const": 2
    },
    "created_at": {
      "description": "The moment the snapshot was started, as a date, a time and the offset from UTC (for example 2026-10-12T07:48:19+00:00). Because it carries its offset it names one exact moment, which is what 'the newest snapshot' is decided by. The folder's name is only local clock time, and misleads on the night the clocks go back.",
      "type": "string",
      "pattern": "^[0-9]{4}-[0-9]{2}-[0-9]{2}T[0-9]{2}:[0-9]{2}:[0-9]{2}[+-][0-9]{2}:[0-9]{2}$"
    },
    "reason": {
      "description": "A short label saying why the snapshot was taken: 'manual' from the Backup Management page, or 'pre-upgrade-' followed by the release number from the upgrade page.",
      "type": "string"
    },
    "php_version": {
      "description": "The version of PHP that took the snapshot. For people investigating a problem; nothing acts on it.",
      "type": "string"
    },
    "mysql_server": {
      "description": "The database server's own version text at the time. For people investigating a problem; nothing acts on it.",
      "type": "string"
    },
    "portal_version": {
      "description": "The release of the portal that took the snapshot, or an empty text when it was taken by a tool that does not load the portal. The recovery guide reads this to find which release's code a snapshot belongs with.",
      "type": "string"
    },
    "time_zone": {
      "description": "The time zone the database connection was set to while the snapshot was read, as an offset: always +00:00. A TIMESTAMP column holds a moment but is handed over as clock time in the connection's zone, so the zone has to be fixed and written down, and the restore sets the same one. Without this a snapshot moved by hours when restored on a host in another zone.",
      "type": "string",
      "pattern": "^[+-][0-9]{2}:[0-9]{2}$"
    },
    "whole_database": {
      "description": "True when the snapshot covers the whole database, which every snapshot the portal takes does. It is written so that a RESTORE can tell a snapshot this portal wrote from a manifest somebody has edited by hand. Three tables may be put back only as part of a whole restore, and 'restore all' used to take its table list from this manifest and ask nothing else — so a manifest edited down to one of those names turned a whole restore into exactly the one-table restore the other path refuses. A manifest WITHOUT this property cannot be told apart from an edited one, so a restore leaves those three tables alone and says it has done so.",
      "type": "boolean"
    },
    "table_count": {
      "description": "How many tables the snapshot holds. The same fact as the number of entries in 'tables', kept separately so that it survives somebody deleting entries from that object. Nothing refuses a snapshot on this alone: it is there for a person comparing a manifest against what it contains.",
      "type": "integer",
      "minimum": 1
    },
    "tables": {
      "description": "One entry per table in the snapshot, keyed by the table's name. Only tables whose names start with tbl are copied.",
      "type": "object",
      "minProperties": 1,
      "propertyNames": { "pattern": "^[A-Za-z_][A-Za-z0-9_]*$" },
      "additionalProperties": { "$ref": "#/$defs/table" }
    },
    "unlisted_values": {
      "description": "Values the snapshot found that are NOT on their column's list of choices, one entry for each column that holds any. Always present: an empty list means the snapshot looked and found none. A column with a list of choices (an ENUM), on a database set to accept anything, stores a value that is not on its list as an empty text and says nothing. A restore refuses such a value rather than change it, so a snapshot with anything in this list CANNOT BE PUT BACK WHOLE until those rows are mended in the live database and a new snapshot is taken. It is still good for looking at, and for putting back a single table that holds no such value. The backup page, the upgrade page and the health page all read this list and say so.",
      "$comment": "FOR MAINTAINERS. Added on 12 October 2026, before form 2 was ever released, so every form 2 manifest a release writes has it and it is required here. The class still reads a manifest WITHOUT it (DbBackup::unlistedIn() then reports nothing), because a snapshot is never refused over a missing note; what cannot be told from such a manifest is whether anybody looked. A SET column is not looked at: the database drops a word that is not on a SET's list and keeps the rest, which goes back unchanged.",
      "type": "array",
      "items": { "$ref": "#/$defs/unlistedValue" }
    }
  },
  "$defs": {
    "unlistedValue": {
      "description": "One column holding values that are not on its list of choices.",
      "type": "object",
      "additionalProperties": false,
      "required": ["table", "column", "cells"],
      "properties": {
        "table": {
          "description": "The table the column is in.",
          "type": "string",
          "pattern": "^[A-Za-z_][A-Za-z0-9_]*$"
        },
        "column": {
          "description": "The column, which has a list of choices (an ENUM).",
          "type": "string",
          "pattern": "^[A-Za-z_][A-Za-z0-9_]*$"
        },
        "cells": {
          "description": "How many rows of the table held such a value in this column at the moment the snapshot was taken. Never 0: a column with none has no entry.",
          "type": "integer",
          "minimum": 1
        }
      }
    },
    "table": {
      "description": "What the snapshot holds for one table.",
      "type": "object",
      "additionalProperties": false,
      "required": ["columns", "rows", "sha256", "file"],
      "properties": {
        "columns": {
          "description": "The table's columns, in the order their values appear in each row of its file. Columns the database works out for itself are left out, because they cannot be written back.",
          "type": "array",
          "minItems": 1,
          "items": { "type": "string", "pattern": "^[A-Za-z_][A-Za-z0-9_]*$" }
        },
        "rows": {
          "description": "How many rows the table's file holds. Compared with the file before a restore touches anything.",
          "type": "integer",
          "minimum": 0
        },
        "sha256": {
          "description": "The SHA-256 checksum of the table's file, as 64 hexadecimal digits. A file that no longer matches has been changed, damaged or cut short since the snapshot was taken, and the restore refuses it.",
          "type": "string",
          "pattern": "^[0-9a-f]{64}$"
        },
        "file": {
          "description": "The name of the table's file inside the snapshot folder: the table's name followed by .jsonl. Described by backup-table-file.schema.json.",
          "type": "string",
          "pattern": "^[A-Za-z_][A-Za-z0-9_]*\\.jsonl$"
        }
      }
    }
  }
}
