{
    "format": 2,
    "created_at": "2026-10-27T18:15:07+00:00",
    "reason": "sample for the schema check",
    "php_version": "8.5.11",
    "mysql_server": "8.0.36",
    "portal_version": "",
    "time_zone": "+00:00",
    "whole_database": true,
    "table_count": 228,
    "tables": {
        "tblExternalEventChoices": {
            "columns": [
                "choiceID",
                "siteID",
                "feedID",
                "scope",
                "externalUidHash",
                "externalRecurrenceKey",
                "audienceLevel",
                "detailLevel",
                "websiteOptIn",
                "apiOptOut",
                "fromDate",
                "toDate",
                "overridesPrivateMark",
                "note",
                "createdByID",
                "createdAt",
                "updatedByID",
                "updatedAt"
            ],
            "rows": 1,
            "sha256": "6e5d04ecf6cdfdff5affba04092d9f31415cdb9ad647daf4772a1f29185a856a",
            "file": "tblExternalEventChoices.jsonl"
        },
        "tblExternalFeeds": {
            "columns": [
                "feedID",
                "siteID",
                "name",
                "url",
                "fetchEveryMins",
                "timezone",
                "categoryID",
                "audienceLevel",
                "websiteOptIn",
                "apiOptOut",
                "isActive",
                "lastFetchedAt",
                "nextFetchAt",
                "refreshLeaseUntil",
                "consecutiveFailures",
                "lastFetchOk",
                "lastFetchStatus",
                "lastFetchMessage",
                "lastContentHash",
                "lastCompleteAt",
                "lastRunCapped",
                "lastImportCount",
                "createdByID",
                "updatedByID",
                "createdAt",
                "updatedAt"
            ],
            "rows": 1,
            "sha256": "e8e659e1b5f6efc6de520f3f189e53a5c9dbd0311391bec3b17a9e601a99995b",
            "file": "tblExternalFeeds.jsonl"
        }
    },
    "unlisted_values": []
}
